編號,客家語,客語標音,客語音檔,華語詞義,例句,例句音檔,翻譯,備註,詞性1,詞性2,分類
11-199,揲衰人,diabˋ suiˇ nginˋ,https://wiki.hakka.gov.tw/file/107/3/zh/w/2zh-11-199.mp3,造成他人困擾。,走幾下回去學校拁你送課本，正經揲衰人。,https://wiki.hakka.gov.tw/file/107/3/zh/s/2zh-11-199s.mp3,跑好幾回學校幫你送課本，真的是弄得我很困擾。,,動詞,,11社會關係與行為
11-200,搣漦搣鼻（創漦創鼻）,meedˋ siauˋ meedˋ pinn (cong^ siauˋ cong^ pinn),https://wiki.hakka.gov.tw/file/107/3/zh/w/2zh-11-200.mp3,做一些沒意義的事。,平常時毋認真讀書，歇睏日猶搣漦搣濞，討仰子有好成績？,https://wiki.hakka.gov.tw/file/107/3/zh/s/2zh-11-200s.mp3,平常不努力念書，假日還盡做些沒意義的事，要怎樣有好成績？,,動詞,,11社會關係與行為
11-201,面逼逼,mien^ bedˊ bedˊ,https://wiki.hakka.gov.tw/file/107/3/zh/w/2zh-11-201.mp3,臉色難看，不悅狀。,人和佢講事，佢面逼逼無愛插人。,https://wiki.hakka.gov.tw/file/107/3/zh/s/2zh-11-201s.mp3,人家跟他說話，他就臉色難看不搭理人。,,形容詞,,11社會關係與行為
11-202,面皮恁賁,mien^ piˋ ngin^ punˇ,https://wiki.hakka.gov.tw/file/107/3/zh/w/2zh-11-202.mp3,臉皮厚，不知羞恥；相反詞為「面皮恁薄」。,少年人面皮恁賁，好手好腳，猶敢拁人討錢。,https://wiki.hakka.gov.tw/file/107/3/zh/s/2zh-11-202s.mp3,年輕人臉皮這麼厚，好手好腳，還敢跟人家要錢。,,形容詞,,11社會關係與行為
11-203,面挷毋會落來,mien^ bangˇ mˇ moi loo loiˋ,https://wiki.hakka.gov.tw/file/107/3/zh/w/2zh-11-203.mp3,拉不下臉。,佢真硬頸又愛面皮，面挷毋會落來，愛佢拁厥夫娘會失禮係無可能个。,https://wiki.hakka.gov.tw/file/107/3/zh/s/2zh-11-203s.mp3,他很固執又愛面子，拉不下臉皮，要他向他老婆道歉是不可能的。,,短語,,11社會關係與行為
11-204,面皮皮,mien^ piˋ piˋ,https://wiki.hakka.gov.tw/file/107/3/zh/w/2zh-11-204.mp3,厚著臉皮。,作業無寫，猶面皮皮喊先生得佢分數，毋知見笑。,https://wiki.hakka.gov.tw/file/107/3/zh/s/2zh-11-204s.mp3,作業沒寫，還厚著臉皮要老師給他分數，不知羞恥。,,形容詞,,11社會關係與行為
11-205,摸彩,moˋ cai^,https://wiki.hakka.gov.tw/file/107/3/zh/w/2zh-11-205.mp3,摸彩。,食尾牙大討會有摸彩活動。,https://wiki.hakka.gov.tw/file/107/3/zh/s/2zh-11-205s.mp3,吃尾牙一般會有摸彩活動。,,動詞,,11社會關係與行為
11-206,無打算,moˋ da^ son^ ,https://wiki.hakka.gov.tw/file/107/3/zh/w/2zh-11-206.mp3,沒打算、沒計畫。,恁多歲啊，毋會用擱像成擺恁無打算，爺哀即係會擘心哦。,https://wiki.hakka.gov.tw/file/107/3/zh/s/2zh-11-206s.mp3,這麼多歲了，不可以再像以前那樣沒計畫，父母可是會擔心啊。,,動詞,,11社會關係與行為
11-207,無規矩,moˋ guiˇ gi^,https://wiki.hakka.gov.tw/file/107/3/zh/w/2zh-11-207.mp3,沒規矩、不守規矩。另言「無規無矩」即為沒有紀律之意。,你仰子坐在神桌崠？恁無規矩，較緊落來！,https://wiki.hakka.gov.tw/file/107/3/zh/s/2zh-11-207s.mp3,你怎麼坐在神桌上？真沒規矩，趕快下來！,,形容詞,,11社會關係與行為
11-208,無愛應佢,moˋ oi^ en^ gui^,https://wiki.hakka.gov.tw/file/107/3/zh/w/2zh-11-208.mp3,故意不回應，不甩他。,大家無愛應佢定，佢嗄愈來愈好款。,https://wiki.hakka.gov.tw/file/107/3/zh/s/2zh-11-208s.mp3,大家故意不回應而已，他卻越來越囂張。,,短語,,11社會關係與行為
11-209,無成,moˋ shinˋ,https://wiki.hakka.gov.tw/file/107/3/zh/w/2zh-11-209.mp3,沒有成功。,佢這擺做媒人做無成。,https://wiki.hakka.gov.tw/file/107/3/zh/s/2zh-11-209s.mp3,他這次做媒沒做成。,,虛詞,,11社會關係與行為
11-210,無大無細,moˋ tai moˋ se^ ,https://wiki.hakka.gov.tw/file/107/3/zh/w/2zh-11-210.mp3,"不分長幼尊卑，胡鬧沒規矩，用以指責目無尊長的人。
例如：遐個後生子人真粗蠻，在老儕人面前也無大無細，惡桀桀。
例如：做人愛知規矩，毋好無大無細，毋知分寸。",,,"那年輕人很粗野，在老人家面前也沒大沒小，凶巴巴的。
做人要懂規矩，不要沒大沒小，不知分寸。",,形容詞,,11社會關係與行為
11-211,無面無皮,moˋ mien^ moˋ piˋ,https://wiki.hakka.gov.tw/file/107/3/zh/w/2zh-11-211.mp3,不講情面，沒有羞恥。,無面無皮个人，毋使和佢講恁多，較講嘛共樣。,https://wiki.hakka.gov.tw/file/107/3/zh/s/2zh-11-211s.mp3,不講情面的人，不用跟他說那麼多，再說也一樣。,,形容詞,,11社會關係與行為
11-212,無按算,moˋ on^ son^,https://wiki.hakka.gov.tw/file/107/3/zh/w/2zh-11-212.mp3,沒預算、沒準備。,今日毋好在屋下食飯，𠊎無按算煮飯哦！,https://wiki.hakka.gov.tw/file/107/3/zh/s/2zh-11-212s.mp3,今天別在家裡吃飯，我可沒準備煮飯喔！,,形容詞,,11社會關係與行為
11-213,望,mong,https://wiki.hakka.gov.tw/file/107/3/zh/w/2zh-11-213.mp3,指望。,莫麼个攏望細子，自家身體顧好較贏。,https://wiki.hakka.gov.tw/file/107/3/zh/s/2zh-11-213s.mp3,別什麼都指望小孩，自己身體顧好比較要緊。,,動詞,,11社會關係與行為
11-214,默默,hm^ hm^,https://wiki.hakka.gov.tw/file/107/3/zh/w/2zh-11-214.mp3,沉默少言。,佢个個性默默，無麼个嘴碼。,https://wiki.hakka.gov.tw/file/107/3/zh/s/2zh-11-214s.mp3,他的個性沉默少言，沒什麼口才。,,形容詞,,11社會關係與行為
11-215,問暢个,mun^ tiung^ eˇ,https://wiki.hakka.gov.tw/file/107/3/zh/w/2zh-11-215.mp3,問開心的，表示沒有意義的發問，多此一問。,這個人客菜價問問个擱無買，實在係問暢个。,https://wiki.hakka.gov.tw/file/107/3/zh/s/2zh-11-215s.mp3,這個客人問了菜價又不買，真的是問開心的。,,動詞,,11社會關係與行為
11-216,揇人,lam^ nginˋ,https://wiki.hakka.gov.tw/file/107/3/zh/w/2zh-11-216.mp3,用手抱人。,這個細子䀴着人即揇人，毋驚生份。,https://wiki.hakka.gov.tw/file/107/3/zh/s/2zh-11-216s.mp3,這個孩子見人就抱，不怕生。,,動詞,,11社會關係與行為
11-217,難做人,nanˋ zoo^ nginˋ ,https://wiki.hakka.gov.tw/file/107/3/zh/w/2zh-11-217.mp3,難做人。,逐儕攏想討和佢共組，得佢真難做人。,https://wiki.hakka.gov.tw/file/107/3/zh/s/2zh-11-217s.mp3,每個人都想要跟他同組，讓他很難做人。,,動詞,,11社會關係與行為
11-218,真虯,zhinˇ kiuˋ,https://wiki.hakka.gov.tw/file/107/3/zh/w/2zh-11-218.mp3,指人小氣，有進無出，過度節省。,拁真虯个人借物件無恁簡單。,https://wiki.hakka.gov.tw/file/107/3/zh/s/2zh-11-218s.mp3,跟小氣的人借東西，沒那麼容易。,,形容詞,,11社會關係與行為
11-219,虯鬼,kiuˋ gui^,https://wiki.hakka.gov.tw/file/107/3/zh/w/2zh-11-219.mp3,吝嗇鬼、鐵公雞，指稱一個人一毛不拔非常小氣，是貶義的用法。,這個虯鬼，愛佢請食飯即無恁快。,https://wiki.hakka.gov.tw/file/107/3/zh/s/2zh-11-219s.mp3,這個吝嗇鬼，要他請吃飯可沒那麼容易。,,名詞,,11社會關係與行為
11-220,硬直,ngang chidˋ,https://wiki.hakka.gov.tw/file/107/3/zh/w/2zh-11-220.mp3,指人的個性正直、耿直。,佢做人硬直，絕對毋會講花舌。,https://wiki.hakka.gov.tw/file/107/3/zh/s/2zh-11-220s.mp3,他為人正直，絕對不會說謊。,,形容詞,,11社會關係與行為
11-221,硬角,ngang gooˊ,https://wiki.hakka.gov.tw/file/107/3/zh/w/2zh-11-221.mp3,形容人的個性強硬頑固，冥頑不靈，常用於負面。,細子恁硬角定著愛教，正毋會學壞。,https://wiki.hakka.gov.tw/file/107/3/zh/s/2zh-11-221s.mp3,小孩子個性這麼頑固一定要教，才不會學壞。,,形容詞,,11社會關係與行為
11-222,硬殼,ngang kooˊ,https://wiki.hakka.gov.tw/file/107/3/zh/w/2zh-11-222.mp3,指人個性固執、不知變通或堅持己見。,佢真硬殼，愛佢聽你講係無可能个。,https://wiki.hakka.gov.tw/file/107/3/zh/s/2zh-11-222s.mp3,他很堅持己見，要他聽你說是不可能的。,,形容詞,,11社會關係與行為
11-223,你个額,henˋ e ngiaˊ,https://wiki.hakka.gov.tw/file/107/3/zh/w/2zh-11-223.mp3,你的份。,雞卵糕有兩垤，毋過你个額得你阿弟食去啊！,https://wiki.hakka.gov.tw/file/107/3/zh/s/2zh-11-223s.mp3,蛋糕有兩塊，可是你的那份被你弟弟吃掉了！,,名詞,,11社會關係與行為
11-224,惹人,rhia^ nginˋ,https://wiki.hakka.gov.tw/file/107/3/zh/w/2zh-11-224.mp3,招惹他人。,食飽傷閒係無？去惹人做麼个？,https://wiki.hakka.gov.tw/file/107/3/zh/s/2zh-11-224s.mp3,吃飽太閒是嗎？一直去招惹人家幹嘛？,,動詞,,11社會關係與行為
11-225,掖錢（攝錢）,iabˋ cienˋ (ngiabˋ cienˋ),https://wiki.hakka.gov.tw/file/107/3/zh/w/2zh-11-225.mp3,偷偷藏錢。,阿怙偷掖錢想討買薰，得阿依發現。,https://wiki.hakka.gov.tw/file/107/3/zh/s/2zh-11-225s.mp3,爸爸偷偷藏錢想要買香菸，被媽媽發現。,,動詞,,11社會關係與行為
11-226,掖私伽,iabˋ suˇ kiaˇ,https://wiki.hakka.gov.tw/file/107/3/zh/w/2zh-11-226.mp3,藏私房錢。,公姐子毋使掖私伽啦。,https://wiki.hakka.gov.tw/file/107/3/zh/s/2zh-11-226s.mp3,夫妻間無需藏私房錢啦。,,動詞,,11社會關係與行為
11-227,入莊隨俗,ngibˋ zongˇ suiˋ siu,https://wiki.hakka.gov.tw/file/107/3/zh/w/2zh-11-227.mp3,入境隨俗。,媽祖生遐日，真多外國人入莊隨俗，跈个祭拜求平安。,https://wiki.hakka.gov.tw/file/107/3/zh/s/2zh-11-227s.mp3,媽祖誕辰那天，很多外國人入境隨俗，跟著祭拜求平安。,,名詞,,11社會關係與行為
11-228,認分,ngin fun,https://wiki.hakka.gov.tw/file/107/3/zh/w/2zh-11-228.mp3,守分、安分。,韶日討考試啊，阿弟真認分，在屋下讀書。,https://wiki.hakka.gov.tw/file/107/3/zh/s/2zh-11-228s.mp3,明天要考試了，弟弟很安分，在家讀書。,,動詞,,11社會關係與行為
11-229,認毋識,ngin mˋ shidˊ,https://wiki.hakka.gov.tw/file/107/3/zh/w/2zh-11-229.mp3,認不出。,十外年無䀴着，這滿在路堵着全認毋識。,https://wiki.hakka.gov.tw/file/107/3/zh/s/2zh-11-229s.mp3,十多年不見，現在路上相遇完全不認得。,,動詞,,11社會關係與行為
11-230,認人,ngin nginˋ,https://wiki.hakka.gov.tw/file/107/3/zh/w/2zh-11-230.mp3,一般指小孩能認出熟人與陌生人。,這個細子會認人，你攙佢毋會着啦！,https://wiki.hakka.gov.tw/file/107/3/zh/s/2zh-11-230s.mp3,這小孩能認出熟人與陌生人，你抱不到他啦！,,動詞,,11社會關係與行為
11-231,人死債爛,nginˋ si^ zai^ lan,https://wiki.hakka.gov.tw/file/107/3/zh/w/2zh-11-231.mp3,人死債消。,成過人死債爛个想法，現時無合用啊。,https://wiki.hakka.gov.tw/file/107/3/zh/s/2zh-11-231s.mp3,以前人死債消的想法，現在不適用了。,,副詞,,11社會關係與行為
11-232,牛頭馬面,ngiuˋ teuˋ maˇ mien^,https://wiki.hakka.gov.tw/file/107/3/zh/w/2zh-11-232.mp3,罵人不像樣、一副沒有人性的禽獸模樣。,厥後生真毋像人，逐日遊遊野野毋做事，交个朋友全部係牛頭馬面。,https://wiki.hakka.gov.tw/file/107/3/zh/s/2zh-11-232s.mp3,他兒子很不像樣，每天閒蕩不工作，交的朋友全都是不像樣的。,,形容詞,,11社會關係與行為
11-234,戇猴,ngongˇ heuˋ,https://wiki.hakka.gov.tw/file/107/3/zh/w/2zh-11-234.mp3,傻猴子，常用來說人傻。,戇猴！阿公頭惜你啦！,https://wiki.hakka.gov.tw/file/107/3/zh/s/2zh-11-234s.mp3,傻瓜！爺爺最疼你了！,,名詞,,11社會關係與行為
11-235,屎缸蟲,shi^ gongˇ chungˋ,https://wiki.hakka.gov.tw/file/107/3/zh/w/2zh-11-235.mp3,本指糞坑中的蛆蟲，後常用於比喻好動、坐不住的人。,這個細子若屎缸蟲，直直䀴遐䀴這。,https://wiki.hakka.gov.tw/file/107/3/zh/s/2zh-11-235s.mp3,這個小孩好動坐不住，一直東張西望。,,名詞,,11社會關係與行為
11-236,噥噥公（噥噥婆）,nungˋ nungˋ gungˇ (nungˋ nungˋ pooˋ),https://wiki.hakka.gov.tw/file/107/3/zh/w/2zh-11-236.mp3,嘮叨不休的人。,俗語講：「家無噥噥公，逐件空。」,https://wiki.hakka.gov.tw/file/107/3/zh/s/2zh-11-236s.mp3,俗話說：「家裡沒有嘮叨不休的人，樣樣空。」意為若有老人家在身邊耳提面命，提供人生經驗，那麼做事成功的機會就會增加。,,名詞,,11社會關係與行為
11-237,野桀桀,rhiaˆ kiedˋ kiedˋ,https://wiki.hakka.gov.tw/file/107/3/zh/w/2zh-11-237.mp3,行為凶巴巴的樣子。,有麼个事情愛好好參詳，毋好停動着就野桀桀。,https://wiki.hakka.gov.tw/file/107/3/zh/s/2zh-11-237s.mp3,有什麼事情要好好商量，別動不動就凶巴巴的。,,形容詞,,11社會關係與行為
11-238,惡人無膽,ooˊ nginˋ moˋ dam^,https://wiki.hakka.gov.tw/file/107/3/zh/w/2zh-11-238.mp3,凶惡之人，其實最沒膽子。,佢普通時真惡，䀴着巡查就軟腳，正經係惡人無膽。,https://wiki.hakka.gov.tw/file/107/3/zh/s/2zh-11-238s.mp3,他平常很凶惡，一看到警察就腿軟，真是惡人沒膽。,,短語,,11社會關係與行為
11-239,擔輸贏,damˇ shiˇ rhiangˋ,https://wiki.hakka.gov.tw/file/107/3/zh/w/2zh-11-239.mp3,有擔當。,做人愛擔輸贏，若講應承人毋會用漏氣。,https://wiki.hakka.gov.tw/file/107/3/zh/s/2zh-11-239s.mp3,做人要有擔當，若是答應了人不可以失信。,,動詞,,11社會關係與行為
11-240,白行,pa hangˋ,https://wiki.hakka.gov.tw/file/107/3/zh/w/2zh-11-240.mp3,白走一趟。,討取消約會愛量早講，若無會害人白行一輪。,https://wiki.hakka.gov.tw/file/107/3/zh/s/2zh-11-240s.mp3,要取消約會要早點說，不然會害人白跑一趟。,,動詞,,11社會關係與行為
11-241,派頭恁粗,pai^ teuˋ ngin^ cuˇ,https://wiki.hakka.gov.tw/file/107/3/zh/w/2zh-11-241.mp3,架勢那麼大。,有錢人派頭恁粗，做細生日即辦桌。,https://wiki.hakka.gov.tw/file/107/3/zh/s/2zh-11-241s.mp3,有錢人派頭架勢那麼大，做小生日就辦酒席。,,動詞,,11社會關係與行為
11-242,歕雞胲,punˋ geˇ goiˇ,https://wiki.hakka.gov.tw/file/107/3/zh/w/2zh-11-242.mp3,吹牛。,學校舉辦「歕雞胲」比賽，大家聽到哈哈笑。,https://wiki.hakka.gov.tw/file/107/3/zh/s/2zh-11-242s.mp3,學校舉辦「吹牛」比賽，大家聽得哈哈大笑。,,動詞,,11社會關係與行為
11-243,妻舅,ciˇ kiuˇ,https://wiki.hakka.gov.tw/file/107/3/zh/w/2zh-11-243.mp3,妻舅，妻子的兄弟。,𠊎妻舅係大學个教授。,https://wiki.hakka.gov.tw/file/107/3/zh/s/2zh-11-243s.mp3,我妻子的兄弟是大學教授。,,名詞,,11社會關係與行為
11-244,七手八腳,cidˊ shiu^ beedˊ giooˊ,https://wiki.hakka.gov.tw/file/107/3/zh/w/2zh-11-244.mp3,未經統合協調，人多行事反倒慌忙雜亂無效率的現象。,阿源好定泥揾落去，脣頭个人行偎，七手八腳，遐捏這捏，烏白舂，全毋驚佢疾。,https://wiki.hakka.gov.tw/file/107/3/zh/s/2zh-11-244s.mp3,阿源好端端的腿軟昏倒，旁邊的人一走近，七手八腳，捏這捏那，亂捶一通，都不擔心他會痛。,,形容詞,,11社會關係與行為
11-245,七做八毋著,cidˊ zoo^ beedˊ mˋ choo,https://wiki.hakka.gov.tw/file/107/3/zh/w/2zh-11-245.mp3,老是做錯。義同「三做四毋著」。,七做八毋著，做到全然無自信啊。,https://wiki.hakka.gov.tw/file/107/3/zh/s/2zh-11-245s.mp3,老是做錯，做得全沒自信了。,,副詞,,11社會關係與行為
11-246,賤手賤腳,cien shiu^ cien giooˊ,https://wiki.hakka.gov.tw/file/107/3/zh/w/2zh-11-246.mp3,手腳不規矩，喜歡亂動亂摸。,遐個細子賤手賤腳，真愛這摸遐摸。,https://wiki.hakka.gov.tw/file/107/3/zh/s/2zh-11-246s.mp3,那小孩手腳不規矩，很愛亂動亂摸。,,動詞,,11社會關係與行為
11-247,千錯萬錯,cienˇ coo^ bban coo^,https://wiki.hakka.gov.tw/file/107/3/zh/w/2zh-11-247.mp3,千錯萬錯。,千錯萬錯攏𠊎毋著，你無毋著，按會用無？,https://wiki.hakka.gov.tw/file/107/3/zh/s/2zh-11-247s.mp3,千錯萬錯都算我錯，你沒錯，這樣可以嗎？,,形容詞,,11社會關係與行為
11-248,前世無修,cienˋ she^ moˋ siuˇ,https://wiki.hakka.gov.tw/file/107/3/zh/w/2zh-11-248.mp3,前世沒好好修行，才造成今日之後果，具貶義，有時會用來貶低人家，或者貶損自己，自我調侃。,前世無修，後生準新婦。,https://wiki.hakka.gov.tw/file/107/3/zh/s/2zh-11-248s.mp3,前世沒好好修行，兒子被當媳婦用。,,形容詞,,11社會關係與行為
11-249,知臊,diˇ sooˇ,https://wiki.hakka.gov.tw/file/107/3/zh/w/2zh-11-249.mp3,意猶未盡。如「食到會知臊」。,,,吃了想再吃。,,動詞,,11社會關係與行為
11-250,像樣,ciong rhiong,https://wiki.hakka.gov.tw/file/107/3/zh/w/2zh-11-250.mp3,喻指舉止中規中矩。,著長袍即愛配馬褂，正較像樣。,https://wiki.hakka.gov.tw/file/107/3/zh/s/2zh-11-250s.mp3,穿長袍就要配馬褂，才比較中規中矩。,,動詞,,11社會關係與行為
11-251,閃東閃西,shiam^/shamˆ dungˇ shiam^/shamˆ seˇ,https://wiki.hakka.gov.tw/file/107/3/zh/w/2zh-11-251.mp3,藉機躲開，逃避責任。,喊佢做事佢總係閃東閃西，真毋係款！,https://wiki.hakka.gov.tw/file/107/3/zh/s/2zh-11-251s.mp3,叫他做事他總是藉機躲開，真不像話！,,動詞,,11社會關係與行為
11-252,三歲細子,samˇ se^ se^ zu^,https://wiki.hakka.gov.tw/file/107/3/zh/w/2zh-11-252.mp3,三歲小孩。,恁簡單个道理，三歲細子嘛知。,https://wiki.hakka.gov.tw/file/107/3/zh/s/2zh-11-252s.mp3,這麼簡單的道理，三歲小孩也知道。,,名詞,,11社會關係與行為
11-253,三兩重都毋動,samˇ liongˇ chungˇ doo mˋ tungˇ,https://wiki.hakka.gov.tw/file/107/3/zh/w/2zh-11-253.mp3,連很輕易很容易做的事都不去做，謂此人懶惰。,有一兜好額人，自細三兩重都毋動，所以這下麼个攏毋會。,https://wiki.hakka.gov.tw/file/107/3/zh/s/2zh-11-253s.mp3,有些有錢人，從小連很容易做的事都不用自己做，所以現在什麼都不會。,,副詞,,11社會關係與行為
11-254,三條坑水洗毋會淨,samˇ teeuˋ kangˇ fi^ se^  mˋ moi ciang,https://wiki.hakka.gov.tw/file/107/3/zh/w/2zh-11-254.mp3,喻跳入黃河也洗不清。,壞啊！𠊎䀴這擺即三條坑水洗毋會淨啊。,https://wiki.hakka.gov.tw/file/107/3/zh/s/2zh-11-254s.mp3,糟糕了！我看這次可是跳入黃河也洗不清了。,,副詞,,11社會關係與行為
11-255,省省子,sang^ sang^ zu^,https://wiki.hakka.gov.tw/file/107/3/zh/w/2zh-11-255.mp3,使用東西很節儉的樣子。如「省省子食」、「省省子用」,糖恁多定，你即愛省省子食。,https://wiki.hakka.gov.tw/file/107/3/zh/s/2zh-11-255s.mp3,"省著吃。
省著用。
糖果這麼一些些而已，你可要省著點兒吃。",,形容詞,,11社會關係與行為
11-256,笑噳噳,sioo^ ngiˇ ngiˇ,https://wiki.hakka.gov.tw/file/107/3/zh/w/2zh-11-256.mp3,笑嘻嘻的，微笑。,嬰仔生做真得人惜，一䀴着人就笑噳噳。,https://wiki.hakka.gov.tw/file/107/3/zh/s/2zh-11-256s.mp3,嬰兒長得很可愛，一看到人就笑嘻嘻的。,,形容詞,,11社會關係與行為
11-257,笑孩孩,sioo^ hai hai,https://wiki.hakka.gov.tw/file/107/3/zh/w/2zh-11-257.mp3,形容笑容滿面。,阿公阿媽攙孫，祖孫三儕都笑孩孩。,https://wiki.hakka.gov.tw/file/107/3/zh/s/2zh-11-257s.mp3,爺爺奶奶抱孫子，祖孫三人都笑容滿面。,,形容詞,,11社會關係與行為
11-258,笑頭笑面,sioo^ teuˋ sioo^ mien^,https://wiki.hakka.gov.tw/file/107/3/zh/w/2zh-11-258.mp3,歡顏喜面，面帶笑容的樣子。,生理人笑頭笑面，人客䀴着就會去拁佢交關。,https://wiki.hakka.gov.tw/file/107/3/zh/s/2zh-11-258s.mp3,生意人面帶笑容的，客人看了就會去跟他買東西。,,形容詞,,11社會關係與行為
11-259,細叔,se^ shuˊ,https://wiki.hakka.gov.tw/file/107/3/zh/w/2zh-11-259.mp3,小叔，稱丈夫的弟弟。稱丈夫的妹妹則為「細姑」，即小姑。,厥細叔係𠊎國中个同學。,https://wiki.hakka.gov.tw/file/107/3/zh/s/2zh-11-259s.mp3,她小叔是我的國中同學。,,名詞,,11社會關係與行為
11-260,弟嫂,teˇ soo^,https://wiki.hakka.gov.tw/file/107/3/zh/w/2zh-11-260.mp3,丈夫的弟媳，用於嫂嫂輩稱弟媳。,𠊎弟嫂係學校个客事先生。,https://wiki.hakka.gov.tw/file/107/3/zh/s/2zh-11-260s.mp3,我弟媳是學校的客語老師。,,名詞,,11社會關係與行為
11-261,序細,si se^,https://wiki.hakka.gov.tw/file/107/3/zh/w/2zh-11-261.mp3,晚輩。,序大人講个事序細愛斟酌聽。,https://wiki.hakka.gov.tw/file/107/3/zh/s/2zh-11-261s.mp3,長輩說的話晚輩要仔細聽。,,名詞,,11社會關係與行為
11-262,屎胐吂坐燒,shi^ fudˊ mangˇ cooˇ shiooˇ,https://wiki.hakka.gov.tw/file/107/3/zh/w/2zh-11-262.mp3,屁股都還沒坐熱，猶席不暇暖。,屎胐吂坐燒，仰子恁急着討轉屋下？,https://wiki.hakka.gov.tw/file/107/3/zh/s/2zh-11-262s.mp3,屁股都還沒坐熱，怎麼這麼急著要回家？,,短語,,11社會關係與行為
11-263,十嘴九屎朏,shibˋ zhe^ giu^ shi^ fudˊ,https://wiki.hakka.gov.tw/file/107/3/zh/w/2zh-11-263.mp3,形容人多嘴雜，意見紛歧。,一陣人，你一句𠊎一句，十嘴九屎胐，專講一兜不褡不膝个，對問題解決全無路用。,https://wiki.hakka.gov.tw/file/107/3/zh/s/2zh-11-263s.mp3,一群人，你一句我一句，人多嘴雜，專說那些不三不四的，對解決問題全無助益。,,形容詞,,11社會關係與行為
11-264,食百二,shiedˋ baˊ ngi,https://wiki.hakka.gov.tw/file/107/3/zh/w/2zh-11-264.mp3,祝福人活得長壽。,祝福阿公康健食百二。,https://wiki.hakka.gov.tw/file/107/3/zh/s/2zh-11-264s.mp3,祝福爺爺健康長壽。,,動詞,,11社會關係與行為
11-265,食自家,shiedˋ ziˇ gaˇ,https://wiki.hakka.gov.tw/file/107/3/zh/w/2zh-11-265.mp3,伙食自理。,今日公司無夜好食，𠊎轉屋下食自家。,https://wiki.hakka.gov.tw/file/107/3/zh/s/2zh-11-265s.mp3,今天公司沒供應晚餐，我回家自理。,,動詞,,11社會關係與行為
11-266,食蛇食𧊅,shiedˋ shaˋ shiedˋ guai^,https://wiki.hakka.gov.tw/file/107/3/zh/w/2zh-11-266.mp3,什麼都吃、喻大小通吃。,這個人食蛇食𧊅，麼儕攏惑，愛細義哦！,https://wiki.hakka.gov.tw/file/107/3/zh/s/2zh-11-266s.mp3,這個人大小通吃，什麼人都騙，要小心喔！,,形容詞,,11社會關係與行為
11-267,失人禮,shidˊ nginˋ li^,https://wiki.hakka.gov.tw/file/107/3/zh/w/2zh-11-267.mp3,忽視了人情義理。,男女結婚攏愛憑媒六禮，正毋會失人禮。,https://wiki.hakka.gov.tw/file/107/3/zh/s/2zh-11-267s.mp3,男女結婚都要憑媒六禮，才不會有失人情義理。,,動詞,,11社會關係與行為
11-268,轉大人,zheen^ tai nginˋ,https://wiki.hakka.gov.tw/file/107/3/zh/w/2zh-11-268.mp3,長大成人。,幾下年前猶係細子，一𥍉目即轉大人啊。,https://wiki.hakka.gov.tw/file/107/3/zh/s/2zh-11-268s.mp3,幾年前還是小孩子，一轉眼就長大成人了。,,動詞,,11社會關係與行為
11-269,受氣,shiu ki^,https://wiki.hakka.gov.tw/file/107/3/zh/w/2zh-11-269.mp3,生氣，被人或事所激怒。,,,,,動詞,,11社會關係與行為
11-270,臭銃,chiu^ chung^,https://wiki.hakka.gov.tw/file/107/3/zh/w/2zh-11-270.mp3,言行不恭、沒大沒小的行為。,這細子真臭銃，伯公下个神茶甌嘛提來裝尿賞。,https://wiki.hakka.gov.tw/file/107/3/zh/s/2zh-11-270s.mp3,這小孩很頑皮，土地公廟裝神茶的茶杯也拿來裝尿玩。,,形容詞,,11社會關係與行為
11-272,熟面,shu mien^,https://wiki.hakka.gov.tw/file/107/3/zh/w/2zh-11-272.mp3,面熟。而「熟面熟面」則為面熟的樣子。,,,,,形容詞,,11社會關係與行為
11-273,熟事人,shiu su nginˋ,https://wiki.hakka.gov.tw/file/107/3/zh/w/2zh-11-273.mp3,熟識的人。,,,,,名詞,,11社會關係與行為
11-274,孫嫂,sunˇ soo^,https://wiki.hakka.gov.tw/file/107/3/zh/w/2zh-11-274.mp3,孫媳婦。,,,,,名詞,,11社會關係與行為
11-275,𢱤來𢱤去,suˊ loiˋ suˊ kui^,https://wiki.hakka.gov.tw/file/107/3/zh/w/2zh-11-275.mp3,推來推去。,喊你兩兄弟去撿揫，即在遐𢱤來𢱤去，真慘哦！,https://wiki.hakka.gov.tw/file/107/3/zh/s/2zh-11-275s.mp3,叫你們兄弟倆去收拾，就在那裡推來推去，真是的！,,動詞,,11社會關係與行為
11-276,雙頭剪（雙頭了）,sungˇ teuˋ zien^ (sungˇ teuˋ leeu^),https://wiki.hakka.gov.tw/file/107/3/zh/w/2zh-11-276.mp3,賠了夫人又折兵。,這禮拜三，進前應講陪佢去高雄尞，毋單愛出車，猶愛拁公司請假，正經係雙頭剪，了多啊。,https://wiki.hakka.gov.tw/file/107/3/zh/s/2zh-11-276s.mp3,這星期三，先前答應陪他去高雄玩，不只要出車子，還要跟公司請假，真是賠了夫人又折兵，虧多了。,,動詞,,11社會關係與行為
11-277,大出手,tai chidˊ shiu^,https://wiki.hakka.gov.tw/file/107/3/zh/w/2zh-11-277.mp3,出手大方。,頭家這擺大出手，一擺就補助十萬箍。,https://wiki.hakka.gov.tw/file/107/3/zh/s/2zh-11-277s.mp3,老闆這次出手大方，一次就補助十萬元。,,動詞,,11社會關係與行為
11-278,大家,tai gaˇ,https://wiki.hakka.gov.tw/file/107/3/zh/w/2zh-11-278.mp3,"泛指眾人，即我們大家；亦指大家庭，表人口眾多之意。
例如：這站無䀴着你，𠊎人大家攏真想你呢！
例如：阿火伯，後生有七、八個，孫有十外個，會用講係真大家。",,,"好久不見，我們大家都很想你呢！
阿火伯，兒子有七、八個，孫子有十幾個，可以說是人口眾多。",,名詞,,11社會關係與行為
